{
  "$schema": "https://json-schema.org/draft/2020-12/schema",
  "title": "MeshCORE Evidence Manifest",
  "type": "object",
  "required": ["id", "createdAt", "summary"],
  "properties": {
    "id": {"type": "string"},
    "createdAt": {"type": "string"},
    "summary": {"type": "string"},
    "pointers": {"type": "object"}
  }
}
